{
  "schema_version": 1,
  "walkthrough_id": "checkout-refund-flow",
  "revision_id": "expl-002",
  "phase": "exploration",
  "status": "reconciled",
  "components": [
    {
      "id": "component:refund-controller",
      "kind": "component",
      "name": "RefundController",
      "role": "Receives refund HTTP requests.",
      "claim_type": "OBSERVED",
      "confidence": "high",
      "evidence": [ { "file": "src/refunds/RefundController.cs", "line": 12 } ],
      "status": "accepted"
    },
    {
      "id": "component:refund-service",
      "kind": "component",
      "name": "RefundService",
      "role": "Coordinates refund issuance across payment gateway and ledger.",
      "claim_type": "OBSERVED",
      "confidence": "high",
      "evidence": [ { "file": "src/refunds/RefundService.cs", "line": 42 } ],
      "status": "accepted"
    },
    {
      "id": "component:payment-gateway-client",
      "kind": "external",
      "name": "PaymentGatewayClient",
      "role": "Talks to the external payment provider.",
      "claim_type": "INFERRED",
      "confidence": "medium",
      "evidence": [ { "file": "src/refunds/RefundService.cs", "line": 58 } ],
      "status": "accepted"
    }
  ],
  "relationships": [
    {
      "id": "rel:refund-controller--calls--refund-service",
      "from": "component:refund-controller",
      "to": "component:refund-service",
      "kind": "calls",
      "data_shape": "IssueRefundCommand",
      "claim_type": "OBSERVED",
      "confidence": "high",
      "evidence": [ { "file": "src/refunds/RefundController.cs", "line": 30 } ],
      "status": "accepted"
    },
    {
      "id": "rel:refund-service--calls--payment-gateway",
      "from": "component:refund-service",
      "to": "component:payment-gateway-client",
      "kind": "calls",
      "data_shape": "RefundRequest",
      "claim_type": "OBSERVED",
      "confidence": "high",
      "evidence": [ { "file": "src/refunds/RefundService.cs", "line": 58 } ],
      "status": "accepted"
    }
  ],
  "decisions": [
    {
      "id": "decision:sync-vs-async-refund",
      "question": "Should refund issuance be synchronous or queued?",
      "options": [
        { "option": "Synchronous gateway call", "outcome": "rejected", "reason": "Gateway p99 latency is 4s+.", "evidence": [] },
        { "option": "Enqueue to background worker", "outcome": "chosen", "reason": "Matches existing OrderFulfillment queue pattern.", "evidence": [] }
      ],
      "claim_type": "INFERRED",
      "confidence": "medium",
      "status": "accepted"
    },
    {
      "id": "decision:storage-format",
      "question": "How should refund audit records be stored?",
      "options": [
        { "option": "Append to RefundLedger table", "outcome": "chosen", "reason": "Existing table, no migration needed.", "evidence": [] }
      ],
      "claim_type": "OBSERVED",
      "confidence": "high",
      "status": "accepted"
    },
    {
      "id": "decision:auth-boundary",
      "question": "Where should refund authorization be enforced?",
      "options": [
        { "option": "Inside RefundService", "outcome": "chosen", "reason": "Keeps the check next to the mutation.", "evidence": [] }
      ],
      "claim_type": "INFERRED",
      "confidence": "low",
      "status": "proposed"
    }
  ]
}
