{
  "schema_version": 1,
  "walkthrough_id": "checkout-refund-flow",
  "revision_id": "expl-002",
  "phase": "exploration",
  "parent_revision": "expl-001",
  "created_at": "2026-08-26T10:03:00Z",
  "created_by": "claude",
  "source_commit": "abc1234",
  "status": "draft",
  "intent": { "summary": "Add patient cohort CSV export.", "requirement_ref": "" },
  "groups": [
    { "id": "group:domain", "name": "Domain Layer", "parent": null }
  ],
  "components": [
    {
      "id": "component:refund-controller",
      "kind": "component",
      "name": "RefundController",
      "role": "Receives refund HTTP requests.",
      "group": "group:domain",
      "claim_type": "OBSERVED",
      "confidence": "high",
      "evidence": [ { "file": "src/refunds/RefundController.cs", "line": 12, "symbol": "RefundController.Post" } ],
      "status": "accepted"
    },
    {
      "id": "component:refund-service",
      "kind": "component",
      "name": "RefundService",
      "role": "Coordinates refund issuance across payment gateway and ledger.",
      "group": "group:domain",
      "claim_type": "OBSERVED",
      "confidence": "high",
      "evidence": [ { "file": "src/refunds/RefundService.cs", "line": 42, "symbol": "RefundService.Issue" } ],
      "status": "accepted"
    },
    {
      "id": "component:payment-gateway-client",
      "kind": "external",
      "name": "PaymentGatewayClient",
      "role": "Talks to the external payment provider.",
      "claim_type": "INFERRED",
      "confidence": "medium",
      "evidence": [ { "file": "src/refunds/RefundService.cs", "line": 58 } ],
      "status": "proposed"
    }
  ],
  "relationships": [
    {
      "id": "rel:refund-controller--calls--refund-service",
      "from": "component:refund-controller",
      "to": "component:refund-service",
      "kind": "calls",
      "data_shape": "IssueRefundCommand",
      "claim_type": "OBSERVED",
      "confidence": "high",
      "evidence": [ { "file": "src/refunds/RefundController.cs", "line": 30 } ],
      "status": "accepted"
    },
    {
      "id": "rel:refund-service--calls--payment-gateway",
      "from": "component:refund-service",
      "to": "component:payment-gateway-client",
      "kind": "calls",
      "data_shape": "RefundRequest",
      "claim_type": "OBSERVED",
      "confidence": "high",
      "evidence": [ { "file": "src/refunds/RefundService.cs", "line": 58 } ],
      "status": "accepted"
    }
  ],
  "flows": [
    {
      "id": "flow:issue-refund",
      "name": "Issue a refund",
      "steps": [
        {
          "seq": 1,
          "component": "component:refund-controller",
          "action": "receives POST /refunds",
          "evidence": [ { "file": "src/refunds/RefundController.cs", "line": 12 } ],
          "claim_type": "OBSERVED",
          "confidence": "high"
        }
      ]
    }
  ],
  "data_lineage": [
    {
      "id": "lineage:refund-request",
      "name": "RefundRequest lifecycle",
      "stages": [
        {
          "seq": 1,
          "shape": "RefundRequestDTO",
          "component": "component:refund-controller",
          "transformed_by": { "file": "src/refunds/RefundController.cs", "line": 30, "symbol": "RefundController.Post" },
          "claim_type": "OBSERVED",
          "confidence": "high"
        },
        {
          "seq": 2,
          "shape": "IssueRefundCommand",
          "component": "component:refund-service",
          "transformed_by": { "file": "src/refunds/RefundService.cs", "line": 40 },
          "claim_type": "INFERRED",
          "confidence": "medium"
        }
      ]
    }
  ],
  "decisions": [
    {
      "id": "decision:sync-vs-async-refund",
      "question": "Should refund issuance be synchronous or queued?",
      "options": [
        { "option": "Synchronous gateway call", "outcome": "rejected", "reason": "Gateway p99 latency is 4s+.", "evidence": [] },
        { "option": "Enqueue to background worker", "outcome": "chosen", "reason": "Matches existing OrderFulfillment queue pattern.", "evidence": [ { "file": "src/refunds/RefundService.cs", "line": 44 } ] }
      ],
      "claim_type": "INFERRED",
      "confidence": "medium",
      "status": "proposed"
    }
  ],
  "assumptions": [
    {
      "id": "assumption:idempotency-key",
      "statement": "Assuming refund requests are deduped upstream — no dedup logic found in RefundService.",
      "claim_type": "UNKNOWN",
      "confidence": "low",
      "evidence": [],
      "status": "unresolved"
    }
  ],
  "corrections": []
}
